{
  "semana": "2026-S41",
  "periodo": {"inicio": "2026-10-05", "fin": "2026-10-11"},
  "titular": {
    "texto": "Los huthíes golpean una instalación de Aramco mientras la Fed y el BCE esperan a final de mes",
    "noticia_id": "2026-S41-geopolitica-01"
  },
  "lo_esencial": [
    "La Fed y el BCE mantienen los tipos; ambos deciden a finales de octubre.",
    "El empleo de EE. UU. se enfría (solo 29.000 puestos en septiembre) y eso anima a los mercados emergentes.",
    "China prepara más gasto público tras frenarse su crecimiento.",
    "Nvidia, bajo escrutinio por chips de IA que llegan a China sin autorización.",
    "Los huthíes dicen haber atacado una instalación de Aramco en Riad; Arabia Saudí lo niega."
  ],
  "macro_global": [
    {
      "id": "2026-S41-macro-01",
      "hilo_id": "bancos-centrales-tipos-2026",
      "titulo": "La Fed y el BCE mantienen los tipos mientras esperan a finales de octubre",
      "texto": "La Reserva Federal de EE. UU. (el banco central estadounidense) mantiene su tipo de interés en el rango del 3,75-4 %, el precio al que presta dinero a los bancos. El Banco Central Europeo (BCE), que subió sus tipos un cuarto de punto en septiembre, sigue con la facilidad de depósito en el 2,5 %. Ninguno de los dos se reúne esta semana: la Fed decide el 28 de octubre y el BCE el 29.",
      "por_que_importa": "Mientras los tipos se mantienen altos, las hipotecas variables y los préstamos siguen caros tanto en EE. UU. como en la zona euro; el mercado ya empieza a descontar qué harán ambos bancos en sus próximas reuniones.",
      "confianza": "confirmado",
      "relevancia_espana_ue": "alta",
      "fuentes": [
        {"url": "https://fred.stlouisfed.org/series/FEDFUNDS", "medio": "FRED (Fed de San Luis)", "nivel": 1, "fecha": "2026-10-06", "idioma": "en"},
        {"url": "https://data-api.ecb.europa.eu/service/data/FM/D.U2.EUR.4F.KR.DFR.LEV", "medio": "BCE", "nivel": 1, "fecha": "2026-10-06", "idioma": "en"}
      ],
      "cifras": [
        {"valor": "3,75 %", "ref_datos": "fed_tipo"},
        {"valor": "2,5 %", "ref_datos": "bce_tipo_deposito"}
      ]
    }
  ],
  "modulos": {
    "eeuu": {
      "sin_novedades": false,
      "noticias": [
        {
          "id": "2026-S41-eeuu-01",
          "hilo_id": "empleo-eeuu-2026",
          "titulo": "El empleo en EE. UU. se enfría más de lo esperado",
          "texto": "EE. UU. creó solo 29.000 empleos en septiembre, muy por debajo de los 84.000 que esperaban los analistas, y la tasa de paro subió al 4,2 %. Julio y agosto también se revisaron a la baja.",
          "por_que_importa": "Un mercado laboral más débil hace más probable que la Fed baje los tipos antes de lo previsto, lo que en teoría debería abaratar las hipotecas y los préstamos — aunque todavía no ha pasado.",
          "confianza": "confirmado",
          "relevancia_espana_ue": "media",
          "fuentes": [
            {"url": "https://www.bls.gov/news.release/empsit.nr0.htm", "medio": "Bureau of Labor Statistics (BLS)", "nivel": 1, "fecha": "2026-10-02", "idioma": "en"},
            {"url": "https://www.cnbc.com/2026/10/02/jobs-report-september-2026.html", "medio": "CNBC", "nivel": 2, "fecha": "2026-10-02", "idioma": "en"}
          ],
          "cifras": [
            {"valor": "29.000", "ref_datos": null},
            {"valor": "4,2 %", "ref_datos": null}
          ]
        }
      ]
    },
    "europa": {
      "sin_novedades": false,
      "noticias": [
        {
          "id": "2026-S41-europa-01",
          "hilo_id": "aranceles-ue-eeuu-2026",
          "titulo": "La UE sigue notando el frenazo de los aranceles de EE. UU.",
          "texto": "El acuerdo marco entre la UE y EE. UU., en vigor desde el 1 de julio de 2026, fijó un techo del 15 % en los aranceles a la mayoría de las exportaciones europeas. El BCE calcula que el arancel efectivo real que paga la zona euro ronda el 12,1 %, algo menor que su propia estimación de septiembre de 2025 (13,1 %).",
          "por_que_importa": "Los aranceles son como un peaje que pagan las empresas europeas para vender en EE. UU.; si venden menos o pagan más ese peaje, hay menos ingresos que puedan convertirse en inversión o empleo en Europa.",
          "confianza": "confirmado",
          "relevancia_espana_ue": "alta",
          "fuentes": [
            {"url": "https://commission.europa.eu/topics/trade/eu-us-trade-deal_en", "medio": "Comisión Europea", "nivel": 1, "fecha": "2026-07-01", "idioma": "en", "contexto_historico": true},
            {"url": "https://www.ecb.europa.eu/press/projections/html/ecb.projections202512_eurosystemstaff~12ead61977.en.html", "medio": "BCE (proyecciones macroeconómicas)", "nivel": 1, "fecha": "2025-12-01", "idioma": "en", "contexto_historico": true}
          ],
          "cifras": [
            {"valor": "15 %", "ref_datos": null},
            {"valor": "12,1 %", "ref_datos": null}
          ]
        }
      ]
    },
    "asia_china": {
      "sin_novedades": false,
      "noticias": [
        {
          "id": "2026-S41-asia_china-01",
          "hilo_id": "china-estimulo-fiscal-2026",
          "titulo": "China prepara más estímulo fiscal tras frenarse el crecimiento",
          "texto": "El ministro de Finanzas chino, Lan Foan, ha dicho que su departamento estudiará «políticas nuevas y muy específicas» para cumplir el objetivo de crecimiento de este año, después de que la economía se desacelerase. El Gobierno ya ha anunciado un primer paquete de estímulo.",
          "por_que_importa": "China es la segunda economía del mundo; si de verdad gasta más para reactivarla, eso también tira de las exportaciones de otros países (incluida la UE) que le venden maquinaria, lujo o materias primas.",
          "confianza": "una_fuente",
          "relevancia_espana_ue": "media",
          "fuentes": [
            {"url": "https://www.bloomberg.com/news/articles/2026-10-01/china-eyes-more-targeted-fiscal-support-after-growth-slowdown", "medio": "Bloomberg", "nivel": 2, "fecha": "2026-10-01", "idioma": "en"}
          ],
          "cifras": []
        }
      ]
    },
    "emergentes": {
      "sin_novedades": false,
      "noticias": [
        {
          "id": "2026-S41-emergentes-01",
          "hilo_id": "mercados-emergentes-rally-2026",
          "titulo": "Los mercados emergentes suben tras el dato de empleo flojo en EE. UU.",
          "texto": "El índice MSCI de bolsas emergentes subió hasta un 1,1 % el lunes, su mejor día en dos semanas, después de que el dato de empleo de EE. UU. redujese las apuestas a una Fed más dura y el petróleo siguiera cayendo. El ETF que replica ese índice (iShares Core MSCI Emerging Markets IMI, con el que seguimos este dato) cerró la semana en 83,35 $.",
          "por_que_importa": "Cuando se espera que la Fed suba menos los tipos, el dinero vuelve a buscar rentabilidad en economías emergentes — lo contrario de lo que pasa cuando EE. UU. sube tipos agresivamente.",
          "confianza": "una_fuente",
          "relevancia_espana_ue": "baja",
          "fuentes": [
            {"url": "https://www.bloomberg.com/news/articles/2026-10-05/emerging-market-assets-climb-as-fed-hike-bets-cool-oil-drops", "medio": "Bloomberg", "nivel": 2, "fecha": "2026-10-05", "idioma": "en"}
          ],
          "cifras": [
            {"valor": "1,1 %", "ref_datos": null},
            {"valor": "83,35 $", "ref_datos": "msci_em"}
          ]
        }
      ]
    },
    "energia_materias_primas": {
      "sin_novedades": false,
      "noticias": [
        {
          "id": "2026-S41-energia-01",
          "hilo_id": "petroleo-oro-precios-2026",
          "titulo": "El petróleo Brent y el oro, en niveles altos",
          "texto": "El Brent (petróleo de referencia) cerró en 113,96 $ por barril el 29 de septiembre, el último dato oficial disponible. El oro cotiza en torno a 4.195,80 $ la onza.",
          "por_que_importa": "El precio del petróleo influye en lo que pagas por la gasolina y en la inflación general; el oro suele subir cuando hay más incertidumbre en los mercados.",
          "confianza": "confirmado",
          "relevancia_espana_ue": "alta",
          "fuentes": [
            {"url": "https://fred.stlouisfed.org/series/DCOILBRENTEU", "medio": "FRED (Fed de San Luis)", "nivel": 1, "fecha": "2026-09-29", "idioma": "en", "contexto_historico": true}
          ],
          "cifras": [
            {"valor": "113,96 $", "ref_datos": "brent"},
            {"valor": "4.195,80 $", "ref_datos": "oro"}
          ]
        }
      ]
    },
    "tecnologia_ia": {
      "sin_novedades": false,
      "noticias": [
        {
          "id": "2026-S41-tecnologia_ia-01",
          "hilo_id": "nvidia-exportaciones-chips-2026",
          "titulo": "Nvidia, bajo la lupa por cómo sus chips de IA siguen llegando a China",
          "texto": "Pese a los controles de exportación de EE. UU., los chips de inteligencia artificial de Nvidia siguen apareciendo en China por canales no autorizados, y varios responsables de EE. UU. piden explicaciones a la empresa sobre por qué no detectó antes las señales de alerta.",
          "por_que_importa": "Estos chips son el motor de la carrera mundial por la inteligencia artificial; que se salten los controles de exportación es un asunto tanto de seguridad nacional como de competencia entre EE. UU. y China, con Nvidia como la empresa más valiosa del mundo en medio.",
          "confianza": "una_fuente",
          "relevancia_espana_ue": "media",
          "fuentes": [
            {"url": "https://www.bloomberg.com/news/features/2026-10-01/nvidia-faces-questions-over-china-ai-chip-smuggling-cases", "medio": "Bloomberg", "nivel": 2, "fecha": "2026-10-01", "idioma": "en"}
          ],
          "cifras": []
        }
      ]
    },
    "geopolitica_riesgos": {
      "sin_novedades": false,
      "noticias": [
        {
          "id": "2026-S41-geopolitica-01",
          "hilo_id": "houthis-aramco-riad-2026",